{
  "schema_version": "0.1",
  "record_type": "TrainingRunIntent",
  "run_id": "reconstructed-exploitgym-rl-2026-05",
  "developer": "Reconstructed counterfactual (not a filing by any developer)",
  "supersedes": null,
  "amendments_allowed": true,
  "trigger_basis": [
    "safeguards_off_evaluation",
    "covered_developer",
    "predicted_capability_crossing"
  ],
  "start_window": "2026-05-07",
  "end_window": null,
  "compute_band": "1e26-1e27",
  "data_classes": [
    "synthetic_task_environments",
    "public_code_corpora",
    "tool_use_trajectories"
  ],
  "predicted_capability_band": {
    "cyber": "high",
    "autonomy": "high",
    "cbrn": "low",
    "persuasion": "medium"
  },
  "threshold_distance": [
    {
      "domain": "cyber",
      "distance": "at threshold",
      "basis": "internal preparedness scorecard, pre-run estimate"
    },
    {
      "domain": "autonomy",
      "distance": "one band below",
      "basis": "long-horizon agentic suite"
    }
  ],
  "monitoring_instruments": [
    "cot_monitor",
    "reward_seeking_monitor",
    "rl_environment_integrity",
    "access_log_review",
    "egress_log_review"
  ],
  "containment_spec": {
    "egress_policy": "none",
    "egress_allowlist": [],
    "registry_isolation": {
      "package_proxy_isolated": true,
      "artifact_store_isolated": true,
      "shared_filesystem_isolated": true
    },
    "credential_scope": "Per-episode ephemeral credentials, scoped to the task container; no organisation-wide tokens reachable.",
    "inter_agent_comms_permitted": false,
    "shared_writable_surfaces": [
      {
        "surface_id": "eval-scratch-volume",
        "kind": "shared_filesystem",
        "writable_by_agents": true,
        "readable_across_runs": false,
        "justification": "Per-episode scratch space, wiped between episodes; required for multi-step task state."
      }
    ],
    "infrastructure_mode": "digital_twin"
  },
  "safeguards_disabled": {
    "disabled": true,
    "which": [
      "cyber_refusal_policy",
      "tool_use_allowlist",
      "exploit_generation_filter"
    ],
    "sign_off_role": "Head of Preparedness"
  },
  "pause_criteria": [
    {
      "id": "PC-01",
      "description": "Any egress from the evaluation sandbox, direct or indirect, including SSRF and proxied requests.",
      "authority_role": "Head of Preparedness",
      "action": "halt_and_notify",
      "machine_checkable": true,
      "notify": [
        "Head of Security",
        "register operator"
      ],
      "match": {
        "field": "event_class",
        "op": "in",
        "value": [
          "sandbox_egress"
        ]
      }
    },
    {
      "id": "PC-02",
      "description": "Agent write to any shared surface not enumerated in containment_spec.",
      "authority_role": "Head of Preparedness",
      "action": "halt",
      "machine_checkable": true,
      "match": {
        "field": "event_class",
        "op": "eq",
        "value": "undeclared_surface_write"
      }
    },
    {
      "id": "PC-03",
      "description": "Evidence of inter-agent communication, within or across runs.",
      "authority_role": "Head of Preparedness",
      "action": "halt",
      "machine_checkable": true,
      "match": {
        "field": "event_class",
        "op": "eq",
        "value": "inter_agent_comms_established"
      }
    },
    {
      "id": "PC-04",
      "description": "Credential misuse, privilege escalation or code execution against infrastructure outside the task scope.",
      "authority_role": "Head of Security",
      "action": "halt_and_notify",
      "machine_checkable": true,
      "notify": [
        "Head of Preparedness",
        "register operator"
      ],
      "match": {
        "any_of": [
          {
            "field": "event_class",
            "op": "in",
            "value": [
              "privilege_escalation",
              "remote_code_execution",
              "root_access",
              "credential_compromise"
            ]
          }
        ]
      }
    },
    {
      "id": "PC-05",
      "description": "Any agent action reaching a system operated by a third party.",
      "authority_role": "Head of Security",
      "action": "halt_and_notify",
      "machine_checkable": true,
      "notify": [
        "affected operator",
        "register operator"
      ],
      "match": {
        "any_of": [
          {
            "field": "event_class",
            "op": "in",
            "value": [
              "third_party_compromise",
              "lateral_movement",
              "third_party_impact"
            ]
          },
          {
            "field": "third_parties_affected",
            "op": "exists",
            "value": true
          }
        ]
      }
    },
    {
      "id": "PC-06",
      "description": "Agent load causing degradation or outage of shared internal infrastructure.",
      "authority_role": "Head of Security",
      "action": "suspend_and_review",
      "machine_checkable": true,
      "match": {
        "field": "event_class",
        "op": "eq",
        "value": "availability_incident"
      }
    },
    {
      "id": "PC-07",
      "description": "Qualitative evidence in monitored reasoning of deliberate evasion of oversight, including discussion of the monitor itself.",
      "authority_role": "Head of Preparedness",
      "action": "suspend_and_review",
      "machine_checkable": false
    }
  ],
  "restart_protocol": {
    "approval_role": "Head of Preparedness",
    "evidence_bar": "Written root-cause finding naming the surface, evidence the surface is closed, and a re-enumeration of shared writable surfaces verified by the security owner.",
    "intent_amendment_required": true,
    "max_restarts_without_review": 1
  },
  "containment_plan": {
    "permissions_revoked_on_subversion": [
      "registry_write",
      "network_egress",
      "shared_volume_write"
    ],
    "constraints_on_continued_operation": "Continuation only in a fully offline digital twin with no shared writable surfaces.",
    "full_offline_conditions": "Any confirmed egress or third-party contact."
  },
  "eval_plan": [
    {
      "eval_id": "cyber-exploit-suite",
      "domain": "cyber",
      "internal_or_external": "internal",
      "external_holds_pause_authority": false,
      "verification_level": "V1"
    },
    {
      "eval_id": "long-horizon-autonomy",
      "domain": "autonomy",
      "internal_or_external": "joint",
      "external_holds_pause_authority": true,
      "verification_level": "V2"
    }
  ],
  "roles": [
    {
      "function": "training_owner",
      "title": "RL Research Lead",
      "org": "Developer",
      "contact_channel": "restricted-tier channel A",
      "id_hash": "3f1c9a00eeeeeeeeeeeeeeeeeeeeeeeeeeeeeeeeeeeeeeeeeeeeeeeeeeeeeeee"
    },
    {
      "function": "security_owner",
      "title": "Head of Security",
      "org": "Developer",
      "contact_channel": "restricted-tier channel B",
      "id_hash": "3f1c9a01eeeeeeeeeeeeeeeeeeeeeeeeeeeeeeeeeeeeeeeeeeeeeeeeeeeeeeee"
    },
    {
      "function": "eval_owner",
      "title": "Evaluations Lead",
      "org": "Developer",
      "contact_channel": "restricted-tier channel C",
      "id_hash": "3f1c9a02eeeeeeeeeeeeeeeeeeeeeeeeeeeeeeeeeeeeeeeeeeeeeeeeeeeeeeee"
    },
    {
      "function": "pause_authority",
      "title": "Head of Preparedness",
      "org": "Developer",
      "contact_channel": "restricted-tier channel D",
      "id_hash": "3f1c9a03eeeeeeeeeeeeeeeeeeeeeeeeeeeeeeeeeeeeeeeeeeeeeeeeeeeeeeee"
    },
    {
      "function": "restart_authority",
      "title": "Head of Preparedness",
      "org": "Developer",
      "contact_channel": "restricted-tier channel D",
      "id_hash": "3f1c9a04eeeeeeeeeeeeeeeeeeeeeeeeeeeeeeeeeeeeeeeeeeeeeeeeeeeeeeee"
    }
  ],
  "log_retention": {
    "retain_trajectories": true,
    "retain_cot": true,
    "retain_tool_calls": true,
    "retention_months_after_closeout": 24
  },
  "third_party_access_commitment": {
    "scope_summary": "Post-incident investigators receive the full run window including training-time events, with query access to the instigating model under no-copy on-premises conditions.",
    "covers_training_time_events": true,
    "model_access": "api_with_logs",
    "transcript_coverage": "full_run",
    "window_days": 45,
    "investigator_pool": [
      "METR",
      "Redwood Research",
      "national AI safety institute"
    ]
  },
  "disclosure_tier_default": "restricted"
}
